Alert_Type,Category,Priority,Criteria,Hex_Code,Action_Required
Evacuation Order (Go Now!),Life Safety / Immediate Mandate,1,Immediate threat to life and safety. An enforceable order to clear the area immediately. Public roads are restricted to emergency vehicles and outbound traffic only.,E65100,Evacuate immediately. Do not delay to pack or protect property.
Evacuation Warning (Set / Be Ready),Life Safety / Pre-Placement,2,"High probability of an imminent threat to life and safety. Citizens should prepare to evacuate at a moment's notice, especially those with disabilities, large animals, or mobility constraints.",FFA500,"Pack essentials, map routes, and be ready to leave instantly if upgraded to an Order."
Evacuation Advisory (Ready / Aware),Situational Awareness,3,"A wildland fire is active in the region but does not pose an immediate threat. General warning to monitor local media, official feeds, and weather conditions closely.",FFD54F,"Assemble your 'Go Bag', ensure communication plans are set, and stay informed."
Shelter-In-Place Directive,Tactical Mitigation,4,"Evacuation routes are compromised, blocked by fire, or unsafe to travel. Staying indoors inside a designated or cleared structure provides a higher survival probability than fleeing.",B71C1C,"Stay inside, close all windows/doors, turn off HVAC, and move to an interior room away from exterior walls."
Evacuation Center / Temporary Evacuation Point (TEP) Established,Incident Logistics,5,"A short-term staging area designated by emergency managers for evacuees to receive immediate direction, safety information, and basic resources before long-term sheltering.",0288D1,Proceed to the designated location if you require immediate shelter or operational guidance.
All Clear / Repopulation Order,Recovery Phase,6,"Formal declaration by incident command that the fire threat has passed or been mitigated, utilities are stabilized, and it is safe for residents to return to the area.",1B5E20,"Return to your property with caution; look out for hazards like downed power lines, smoldering hot spots, or unstable trees."
